,review_rating,review_text,verified_purchase,total words,total characters
850,4,This is really great product I'm very impressed with it so far. It's effective feels light on my skin I have quite sensitive skin this is great for it so would defo buy again. Packaging is usual for simple products clear direct [This review was collected as part of promotion.],False,57,301
851,4,"It's fine, it does exactly what it says on tin. Love that it's free of perfumes paragons, it's gentle removed my make up like champ. I use it in shower to save time, but I found that while it didn't make my skin feel tight after (win) my skin didn't feel particularly refreshed. It's fine, it does job. [This review was collected as part of promotion.]",False,73,376
852,5,"I love this face wash! Like all simple products it is gentle on my skin, has not caused any reaction or redness. However unlike some products for sensitive skin, it actually manages to work well at same time. I've found that it can also remove makeup well, particularly stubborn eye makeup! [This review was collected as part of promotion.]",False,62,350
853,4,I have been using these wipes for years. They're great. It is only recently I bought biodegradable ones. I then thought why aren't they ALL biodegradable? Something to think about guys....,False,31,188
854,5,The best shop bought mayo.,False,5,26
855,5,"Good stuff, happy",True,3,17
856,5,"Surf Tropical Lily & Ylang Ylang is fab laundry detergent Â awesome smell, brilliant cleaning power Â gets clothes bright clean, fresh even on cold washes. I love how it makes things smell, lasts for some time great cleaning power on general stains like tea, deodorant marks, mud, spag bol so great for our family. Really easy to store, use does. I have often rubbed little into clothing if there is particular stain like spag bol in case it needs little more attention which works wonders even on whites! Really great value having used it on delicate lingerie cottons, towels, silk dresses, man-made fiber clothing like work clothes, I have no complaints with general washing, highly recommend.",True,124,717
857,4,Great softener good Value at price paid,True,9,47
858,1,"I HATE HATE HATE new pump. There seems to be no way to separate it from bottle in order to get out last of lotion. Plus new pump's opening is too big clogs continually. If Vaseline does not fix this, I will have to find new brand after 20 years of loyalty to this one. Shame on Vaseline for \""fixing\"" something that was never broken, all to get customers to purchase new bottle sooner.",False,82,414
859,3,"I2019m happy this toner has no added fragrances to it. It is good for senstive skin yet still does job! I2019m also happy that is contains witch hazel, something that is usually hard to find! The ingredients are simple clear, it does its job. Expecting good results from this product ! [This review was collected as part of promotion.]",False,63,349
860,5,You can't go wrong with this product,True,7,36
861,1,comfort blues skies was missing when my order arrived as must of split as box was soaked smelt of conditioner box was open,True,28,142
862,5,Item as stated delivered on time. Also good price,True,11,55
863,5,as described,True,2,12
864,5,A long standing family favourite. Decent ice cream with yummy bits in to suit everyones taste. A delicious sugary treat,False,20,119
865,5,Ok,True,1,2
866,5,"Beautiful smelling conditioner, although smaller bottles than I normally buy, but I will continue to buy, yes you could say itÂs concentrated. However I have no drawers in my washing machine itÂs auto detergent conditioner type depending on weight of washing load I definitely recommend",True,47,294
867,5,"Since I have Combination/Oily skin, I have never found perfect moisturiser - until now. I am quite particular in moisturisers that I don't like it when they leave greasy feeling on my skin after I've applied it, they take ages to soak in or that they make me break out more. Thankfully, this one doesn't. My skin is more glowy it definitely feels more hydrated smooth since I started using this few months ago. I loved it that much that I repurchased it will be my go to moisturiser. I've seen many others like this but with much higher price tag so good find",False,112,583
868,4,"This is good toner for everyday use, use it morning/evening makes my skin feel really fresh. Has no smell very soft on skin - not right for you if you want it to get rid of spots etc but for an everyday toner I would recommend. [This review was collected as part of promotion.]",False,59,293
869,5,This is first toner that I have used in my skincare routine. I am really impressed with how well it cleans my skin makes it feel really refreshed clean. It is very gentle on my skin has very neutral scent.I would defiantly purchase this again afterwards. [This review was collected as part of promotion.],False,60,324
870,5,"Works well, it made difference to my skin very quickly. It reduced my pores within week made my skin very smooth. Would highly recommend buying ! Cheaper than most products on market so defiantly worth buying ! [This review was collected as part of promotion.]",False,50,274
871,4,"This toner is great for every skin type in my opinion. The product is in plastic bottle which is very travel friendly. My only downside with this is that it's just hole to pour out of I often end up using too much. Good thing about it is that there is no alcohol in it at all! Also, no artificial perfumes or colours. Just natural, which is best for skin. [This review was collected as part of promotion.]",False,83,419
872,5,I'm so happy I found something that works for my skin because I have combination skin so I have to be so careful about what I put on it. I am really happy with this facial wash because I sometimes come out in hives this doesn't aggravate it at all. Go to for all skin types. [This review was collected as part of promotion.],False,66,330
873,5,"Brilliant price on subscribe save, having it on constant order, one of best shampoos ever. Definitely recommend this product. Especially on subscribe save",True,26,166
874,5,"Lovely fragrance, anti persdperant not just body spray works too. On reorder, good value for money",True,17,100
875,5,Nice smell price is cheap!,True,6,30
876,5,"Love this product, more importantly fantastic smells. I buy this shower gel all time.",True,17,97
877,5,Kids grown ups love this ice cream! Whats not to like?!,False,12,59
878,4,Ben Jerrys ice cream never fails to be favourite deliver on flavour.,False,15,78
879,5,"This ice cream is so indulgent is fantastic treat, my son loves addition of chocolate fish which add little bite.",False,25,129
880,5,"This is yummy, only buy as treat but so worth it.",False,12,51
881,5,Good value,True,2,10
882,5,Really good price,True,3,17
883,5,Leaves clothes smelling lovely feeling soft. Good price too.,True,10,64
884,5,"Excellent product, price service - couldn't fault it in any way",True,12,67
885,5,Great bargain! Bottles seemed so tiny but you really don't need lot for soft beautifully scented clothes. Batgain,False,20,119
886,5,Absolutely love this comfort love smell love everything about it absolutely fab all round ????????,True,17,104
887,5,"My favourite conditioner, because I like way it smells.",False,10,59
888,4,"Love fragrance of this item, came well packaged arrived promptly too",True,12,72
889,5,Clothes smell lovely fabric is beautiful soft. The fresh smell lasts all day on my clothes.,True,18,99
890,4,"My friend recommended it to me. After several washes, I hardly to see difference by adding it. Good thing is there is plenty of it, many washes...",True,28,150
891,4,Great washing capsules.,True,3,23
892,3,"Great offer by Superdrug, however it looks like St Ives have changed ingredients for this product as it is not as effective as I remember it being - in particular texture, consistency smell is very different. They need to bring back old product!",False,47,261
893,4,Leaves my severely damaged hair moisturised fluffy. Couldn2019t ask for anymore considering already amazing value for money price.,False,21,142
894,5,"I discovered this amazing product 2 years ago since then it has become staple of mine! I love how after usage skin feels tanned enough, much softer shimmery as well. Could not recommend it more!",False,39,208
895,5,"Great product, it's only moisturiser I use on my sensitive skin.",False,12,68
896,5,I have eczema acne rosacea on my face I use this coz have very dry skin other products sting my face make it worse where as this it makes my skin nice soft is very effective helps my eczema too.,False,47,222
897,5,"So I have oily combination skin type I am forever getting spots blackheads in my t-zone because of this, especially over my nose. Being fed up with it all I started to cleanse, tone moisturise. This toner is by far best one I have ever used. It smells amazing. It doesn2019t irritate my skin like some other brands I2019ve tried do (despite not having sensitive skin) my blackheads spots are clearing up. My oily t-zone isn2019t so much of problem anymore. Definitely getting this from now on recommending to anyone that has similar issues to me [This review was collected as part of promotion.]",False,114,629
898,5,"I2019ve been using this product for few days now I have to say that is really kind to skin.It doesn2019t had bad smell,my skin feels so smooth soft after using it.I truly recommend this product to everyone. [This review was collected as part of promotion.]",False,50,270
899,5,"This product is really surprising! It leaves my face looking feeling so smooth, soft fresh! Its really gentle product feels amazing when being massaged into wet skin. It rinses off without leaving any residue is fantastic value for money! I would certainly recommend this product as part of your every day skin care routine. [This review was collected as part of promotion.]",False,69,398
900,5,I always buy this product. It is really creamy doesn't irritate my skin,False,14,75
901,4,"Bought this for someone else while I was doing my shop, so can2019t personally comment on use of it. They always use simple wash face scrub, say it2019s doesn2019t dry out her skin.",False,35,189
902,4,"Having sensitive skin it's usually difficult to find facial wash that is effective, refreshing, gentle doesn't dry out my skin. This ticked all those boxes my skin was left feeling clean fresh. I will definitely be buying this Simple product again. [This review was collected as part of promotion.]",False,54,314
903,5,"Suffering from mild Ezyema, my skin has always been sensitive dry so i2019m very careful when using skincare products preferring brands who use no nasties. I2019ve been fan of Simple for while now, using their moisturisers face wipes have just switched to using their Kind to Skin face wash. 3 weeks in i2019ve noticed my skin is more radiant less dry than it has been, with my face left feeling clean fresh after each wash. It2019s light, refreshing, non perfumed best of all kind to skin but still cleansing. A great every day mild cleanser that you can introduce to your skin care regime. A great product at very affordable price range. [This review was collected as part of promotion.]",False,131,725
904,4,"I bought this few months ago due to fact that I love Simple skincare products was looking for drugstore face wash that didn2019t have lots of nasties. This is perfect gentle face wash after I take my makeup off, leaved my skin feeling very soft clean, followed by Simple moisturiser it2019s no brainer. [This review was collected as part of promotion.]",False,70,380
905,4,"I really like this product, I use it in my double cleansing routine, after using oil to remove my makeup, this product helps removing all rest. I feel that it really respect my acne prone skin leaves it fresh smooth. [This review was collected as part of promotion.]",False,52,280
906,5,I use to use shops own brand face wash which seemed to dry my face out cause spots since trying simple kind refreshing face wash my face has never felt as soft no signs of dry skin or spots will definitely be buying this face wash [This review was collected as part of promotion.],False,58,294
907,5,I usually like moisturising face wash as I have fairly dry skin but this is lovely to use after long day. Leaves no residue left my skin feeling really soft. I need to be careful not to use too much as little can go along way. [This review was collected as part of promotion.],False,59,288
908,3,"I2019ve been using this daily, product lathers up nicely with little water bottle is good size so it2019ll last long time. I found it quite drying on my skin compared to other facial washes I2019ve used I don2019t think even smell was refreshing to me which was little disappointing [This review was collected as part of promotion.]",False,67,362
909,5,I2019ve been using this face wash for just over week now. I2019m really happy with way it makes my skin feel. It2019s not drying all has no harsh chemical smells. It lathers up really well little goes long way. It removes my make up well leaves my skin nice soft . Great packaging in easy squeeze tube. [This review was collected as part of promotion.],False,75,382
910,5,"I really liked this face wash I would definitely buy it in future. My skin reacts well to simple products, my face was glowing when I got out of shower. I would definitely rocemmend to friend as well. [This review was collected as part of promotion.]",False,51,266
911,5,This is something I've never tried before I've now been using it daily my skin in looking feeling better. It has very delicate smell is easy on skin is all goodness I absolutely love this x [This review was collected as part of promotion.],False,52,267
912,5,This bleach has became bit of obsession of mine. living in very big house 6 bed pool room I use 2 bottles of this each day I have to say I luv it!!. I always used pink bleach in stables aswell but my new favourite has to be white 1. My maid thought it was for white washing added it to whites bedding towels ect it done trick there aswell.,False,81,377
913,5,I always used honey suckle sandalwood 55 wash bottle loved smell of that . But when I was in Asda yesterday I smelt this one wow can honestly say I will be making permanent change to this one itÂs beautiful cherry blossom sweet pea such beautiful smells I just wish you would sell bigger size bottle of this 55washes one like you do in honey suckle sandal wood one can you start selling 55 wash in this one please? Thanks,False,92,468
914,5,"This is one of nicest smelling fabric conditioners I have smelt ever. My clothes always have beautiful scent after using I just canÂt get enough of it, mmmm! Please donÂt stop making this Comfort people!",False,38,215
915,4,Bought this when down in price. Smells in tub. Cleans good on 30 wash. Only reason why I won't buy again clothes don't smell like they do when you put them in.,False,33,161
916,5,"I've been using this product for few days now I have to say that is really kind to skin.It doesn't had bad smell,my skin feels so smooth soft after using it.I truly recommend this product to everyone. [This review was collected as part of promotion.]",False,50,264
917,5,"I've been using this remover for years. It's not scented, not greasy & doesn't irritate eye area even when removing stubborn mascara. Fantastic value too.",False,26,158
918,5,"So I have oily combination skin type I am forever getting spots blackheads in my t-zone because of this, especially over my nose. Being fed up with it all I started to cleanse, tone moisturise. This toner is by far best one I have ever used. It smells amazing. It doesn't irritate my skin like some other brands I've tried do (despite not having sensitive skin) my blackheads spots are clearing up. My oily t-zone isn't so much of problem anymore. Definitely getting this from now on recommending to anyone that has similar issues to me [This review was collected as part of promotion.]",False,114,620
919,3,"I've been using this daily, product lathers up nicely with little water bottle is good size so it'll last long time. I found it quite drying on my skin compared to other facial washes I've used I don't think even smell was refreshing to me which was little disappointing [This review was collected as part of promotion.]",False,67,350
920,5,"Suffering from mild Ezyema, my skin has always been sensitive dry so i'm very careful when using skincare products preferring brands who use no nasties. I've been fan of Simple for while now, using their moisturisers face wipes have just switched to using their Kind to Skin face wash. 3 weeks in i've noticed my skin is more radiant less dry than it has been, with my face left feeling clean fresh after each wash. It's light, refreshing, non perfumed best of all kind to skin but still cleansing. A great every day mild cleanser that you can introduce to your skin care regime. A great product at very affordable price range. [This review was collected as part of promotion.]",False,131,713
921,5,I've been using this face wash for just over week now. I'm really happy with way it makes my skin feel. It's not drying all has no harsh chemical smells. It lathers up really well little goes long way. It removes my make up well leaves my skin nice soft . Great packaging in easy squeeze tube. [This review was collected as part of promotion.],False,75,373
922,4,"I bought this few months ago due to fact that I love Simple skincare products was looking for drugstore face wash that didn't have lots of nasties. This is perfect gentle face wash after I take my makeup off, leaved my skin feeling very soft clean, followed by Simple moisturiser it's no brainer. [This review was collected as part of promotion.]",False,70,374
923,5,"This is best face wash that I have used. It is gentle, fragrance free it does not dry your skin.",False,22,104
924,3,I found that lot of product was needed to remove eye make up. It made my skin feel quite dry around my eyes after using as well.,False,28,130
925,4,A nice mixture of variety you get two of each flavour but its bit too creamy compared to other brands..,False,21,105
926,5,These are yummy especially almond flavoured one as it just melts in your mouth. This is my FAVE! The white chocolate flavoured ice cream is rich creamy. Its great for white chocolate lovers. All three are scrumptious in their own special way. If you like dark chocolate there is sweet treat in there for you too. I would 100% recommend!!,False,63,347
927,2,"For hard water areas, which is most of England, you need to use two capsules in wash giving only 19 washes in this packet, not 38 advertised.",False,29,147
928,3,"These capsules do good job but last two times I've purchased them some have split in packet. This is inconvenient, messy wasteful. They are kept in cool cupboard so they must be getting damaged in transit. Will be using Persil liquid until I read problem has gone away.",False,54,289
929,4,"Just pop it in washer, add washing press go. No problems just simple.",False,15,77
930,5,"Low carb, genuine taste often on offer. Nothing wrong with bottle....",False,13,77
931,5,What can I say! This ice cream was absolutely gorgeous! Thoroughly recommend. Yummy!,False,13,84
932,5,IÂve tried to substitute Magnums with other brands but there is always ÂNot MagnumÂ disappointment from family. I give up! Somethings are not worth cost cutting for. TheyÂre just delicious.,False,33,203
933,5,What can I say but classic smell they came quick,True,12,54
934,5,Gift for my dad. He was pleased,True,7,31
935,5,"Smells nice, itÂs for my boys",True,6,30
936,5,Good,True,1,4
937,5,Brilliant product first class delivery to Spain--well done.,True,9,63
938,2,They just seem bit weird compared to supermarket ones. I pour hot water on them but noodles are quite tough dried out. The ones from supermarket as soon as I pour water on them I can easily mix it around with fork but not these ones.... strange.,True,53,265
939,5,Decent value delivered next day on prime so convenient too.,True,11,63
940,5,Awsme,True,1,5
941,3,Lovely smell but not very big for washes,True,8,40
942,5,Products as expected better value than supermarket,True,8,54
943,5,"I love combination of three products to buy together. The y work well together, fragrance smell nice.",True,20,113
944,2,"Good quality usually. But i have subscription past 2 times it has been delivered, bottle of washing liquid has leaked everywhere I've only had beads conditioner to use.",True,35,194
945,2,Smells lovely but it was all lot smaller than I expected for price. ItÂs half price in supermarkets for sizes you get on amazon,True,28,142
946,1,Washing liquid had leaked in box,True,7,36
947,5,Really good for price,True,5,25
948,3,Veey crafty! Price stays same even though theyÂve changed bottles how many washes you get! Your now getting 2 washes less!,True,24,135
949,5,product as described,True,3,20
950,5,Great product says what it does on tin,True,9,42
951,3,Not as good as powder. Less suds not totally cleaned.,True,12,61
952,5,As expected. Better value than supermarket.,True,6,43
953,5,Washes well,True,2,11
954,5,"Quick delivery, good value",True,4,26
955,5,"Some things in life are enjoyable to buy some things plainly are not. No matter how pretty product how bright bold actual washing detergent is, it will always be grudge purchase. No one likes to have dirty smelly clothes wash powder / tablets / capsules are necessity that makes hole in everyone's weekly grocery budget that could be better spent on something interesting such as cakes or exotic vegetables that you have to look up how to cook. Along with Ariel, Fairy Bold, Persil is one of big brands that dominant market for detergents. It is owned by global consumer products giant Unilever who are experts at branding marketing. It is refreshing to see these capsules at such reasonable value., they work out 15p each which is an absolute bargain. Even dodgy imitation ones you find in sub prime supermarkets are more than these, great thing about Persil is that you can guarantee that product is going to be high quality. These capsules come in rubbery gossamer coated casing containing different brightly coloured gel like liquids in each of four compartments. And very funky they look too with purple, green, white grey swirls of gu. These things wash your clothes nicely too have pleasant smell without being too overbearing. I have no idea what happens to plasticated casing on outside of capsule after you put in in washing machine. Maybe it bio-de-grades, maybe it disappears by magic, this is one of lives great mysteries like Great Sphinx at Giza, Bermuda Triangle or meaning of Voynich Manuscript.",True,287,1624
956,5,Please wash really well there is no residue left in drum. Washing comes out clean smelling fresh.,True,20,109
957,5,"Happy with purchasing this product in bulk, cheaper than picking it up from supermarket. Did not find any residue after wash.",True,23,133
958,4,it clean well,True,3,13
959,5,Second time ordering these. Bargain pack means it works out same per capsule as shops own brand! Clean clothes well. Will definitely reorder again,True,27,156
960,5,Product as described. Arrived on time great value for money .,True,12,65
961,5,Great bulk buy obviously you need space but it's something that you use need,True,15,80
962,4,These were delicious! Only complaint is that they are smaller than normal magnums...,False,13,84
963,1,"I have been cleaning bathrooms in our home with various liquids for years. I bought cif power shine I'm completely disappointed. Tiles, ceramics, mirrors in streaks ...",False,31,182
964,1,"Thought IÂd try this spray..... IÂm sorry to say, it leaves streaks all over kitchen surfaces. Again again. IÂve used many Cif products before - all with great results - but this one is terrible!!",False,37,207
965,5,"I have tried so many antiperspirants all have let me down. LYNX is only brand I can use that keeps me dry all day night. I used to think that LYNX was just for teenagers I had tried to move onto more expensive brands aimed at mid-range male market, but they just didn't work as good as I had hoped. I have returned to LYNX now I smell good stay dry.",True,78,377
966,5,"Brilliant product, lasts long time but can buy it for Â£5 elsewhere.",False,13,70
967,5,Beautiful smell throughout all my washing tip marks,True,8,51
968,5,"I love this wipes, wipes are soft but strong. I use it at late afternoon everyday, this let my face feeling refresh without make up on. And I don't feel dry after using this wipes, when i am crazy, i don't even need to put cream on. I am quite happy with result of this new type of wipes. [This review was collected as part of promotion.]",False,73,360
969,5,"I bought this for my holidays i love it, very fresh smell nice all day long.",False,18,84
970,5,I have very sensitive skin I know I can rely on Simple range to care for my skin. I use this every evening after cleansing it works brilliantly. Would highly recommend to anyone else with sensitive skin. [This review was collected as part of promotion.],False,49,267
971,4,"I didn't get much time to review this product to say if I found it highly effective or not, but I quite liked way it made my skin feel when I applied it. It was easy to apply soaked into my skin fast. It wasn't sticky didn't leave any residue after. [This review was collected as part of promotion.]",False,63,313
972,5,I am really impressed with this product as I have very dry sensitive skin. I choose products I use carefully know I can rely on simple range. Easy to use apply leaves my face feeling fresh clean. [This review was collected as part of promotion.],False,52,271
