,review_rating,review_text,verified_purchase,total words,total characters
475,5,"I love this product, it is amazing. My son suffers from dry skin especially in winter, it has been very sore this last few weeks. I have been using this cream on his legs body it has been improved vastly. It smells lovely too is very smooth when applied. It rubs in perfectly without any residue. I would recommend this product to others would definitely buy it again. [This review was collected as part of promotion.]",False,82,440
476,1,"I used this product for 1 week it has given me really bad under skin spots, this product is also very drying. Would not recommend if you have sensitive skin.",False,31,161
477,5,"I have very oily skin so finding moisturiser that offers SPF protection without leaving greasy film is challenge, but this sinks in so well doesn't make me shiny at all. The only criticism I have is that there is no UVA star rating.",False,47,242
478,5,"I have been using this for years it works really well; it has not damaged any of my clothes. it has not left residue on any of my clothes. it keeps my clothes in good condition colour. it has not irritated my sensitive skin in any way. I have been using Persil silk wool for years it is really good. I only looked on Amazon as my supermarket had not had any for 3 weeks in row, realised it costs about same here on Amazon Pantry. I wash my silk, wool linen items on silk wash ( on my washing machine that is setting, but I think it comes to following...30 degrees C, light action, very low spin cycle - very important not to hard spin wool or silk, ruins fibres) I hang them up to dry. all of these items are either hand wash only or dry clean only items, quite honestly I do not have strength to hand wash or wish to dry clean. This has worked well for me for 10+ years using this detergent.",False,194,948
479,5,Goof,True,1,4
480,4,Is actually good practical to use pot. Keeping hot for while. Easy to make.,True,17,85
481,5,Really Happy good quality value recommend seller no issues as it should be would highly Recommend,True,17,101
482,5,"Large bottles. Shampoo improves hair. Shiny clean. Terrific product for family or group of students. 900 ml lasts for months. Tresemme is superb brand. Affordable price. Speedy delivery, good packaging. Product arrived with extra bubble wrap around bottle.",True,42,268
483,3,Makes your hair oily. Yes it can protect but then your blow dry doesnÂt last for long. Next day you need shower,True,23,114
484,5,"Great value for money. Good for most hair types. Use this in house with 7. Hair ranges for toddler girl, Ânormal boysÂ, curly boys hair, fine thin, very thick long hair that has highlights.... all our hair is clean soft after using! Only negatives are shape of bottle make it hard when wet soapy to hold with one hand to squeeze into other hand. Also if lid is not closed properly then it drys blocked up is hard to clean!",False,87,450
485,5,Nice smell,True,2,10
486,5,Smells lovely,True,2,13
487,5,Good value,True,2,10
488,5,Good value pack fast service,True,5,28
489,5,"Best deodorant brand that always deliver, smells amazing",True,8,56
490,5,Good value for price,True,5,24
491,5,Good value,True,2,10
492,5,Great bo beater. Smells nice,False,5,28
493,5,"Really does work well pleasant smell. Doesn't stain clothes, excellent product",True,13,84
494,5,"Love this comfort,smells so fresh",True,5,33
495,5,"Smells gorgeous huge bottle last ages ! bought 4 of these stocked up , will purchase again leaves clothes smelling lovely",True,22,125
496,5,Good,True,1,4
497,5,Smells nice. Soft static free,True,6,33
498,5,"I like because it is unperfumed that is vitally important from my little 'Bunny Rabbits'point of view...yes she likes things clean &Soft...hence this babysoft conditioner,but if there was perfume stronger than hers there would be trouble..No body is offended by her naturual scent,living on fresh hay eating rose petals you can imagine how beautiful her little Bunny self smells.Fake perfume would send her scent glands into overdrive she would be compelled to mark everything.!!! So for that reason,this product passes thr Bunny test.Soft & unscented perfect,Mrs Bunny sez so !",True,94,592
499,5,Smells so nice leaves clothes smelling nice fresh i got 2 of these they will last very long while as they are big bottles very pleased with my purchase,True,32,161
500,5,Smells good keeps pits dry. Can't go wrong with Dove deodorant.,True,13,71
501,5,As expected,True,2,11
502,4,Its shower gel,True,3,14
503,5,"Excellent price size, especially how much Mrs poors in.",True,11,63
504,5,Excellent value for price.... in fact I bought 2,True,10,52
505,5,Lovely smell last for ages on clothes,True,7,37
506,5,Great,True,1,5
507,5,Great as multi pack on subscription,True,7,37
508,5,This is what better half wanted is cheaper than bought locally.,True,13,71
509,5,"What can I say, does job, pleased with purchase, will definitely be buying more",True,15,83
510,5,work as expected,True,4,20
511,5,Hard to get on hands you think that you haven't got enough but very small amount keeps hair in place. I think three tubs will last very long time.,True,33,158
512,2,"Purchased these as they were cheap but I really had forgotten how bad they taste, it's like chewing an old wet rope, I hope kids like them because that's what they're having when they get home from school ha ha ha, of course, I will lie say they taste great.",True,52,266
513,5,"Handy things to keep in cupboard, they're perfect for quick snack. Great price for pack of 12. My order arrived as expected, packed well.",True,26,143
514,5,I use Marmite on sausages instead of mustard. Am I addicted?,True,11,60
515,5,Good price fast delivery,True,4,24
516,5,keeps home fresh clean.,True,6,31
517,5,Like.,True,1,5
518,5,Absolutely love these comfort Creation fabric conditioners they smell really nice makes whole house smell wonderful. These were on deal so saved few quid this bulk buy was well worth buying.One very happy customer will buy again when needed but get tempted Everytime it's on,True,48,284
519,5,"This is best shampoo I've ever used. It makes my hair shiny, soft full of body. Just tiny bit goes long way. 1 bottle lasts for months! Wonderful stuff!! I love it.",True,36,176
520,5,Brilliant quality for price,False,5,31
521,5,I absolutely love this deodorant it's so much cheaper to buy on line,True,14,72
522,5,Good value for big pots.,True,5,24
523,5,5*,True,1,2
524,5,I love this scent to get it on offer was massive bonus. Always leaves washing smelling beautifully fresh & if I hang bedding sheets on radiators while theyÂre drying whole house is perfumes. Love it.,True,39,214
525,4,Really pleased with this conditioner. Smells lovely. Good offer. Could leave clothes little softer but overall good product.,True,20,128
526,3,Lovely smell however few bottles were only half full,True,10,54
527,5,Bought in bulk I'm still working my way through it all . I shall buy again,True,17,78
528,3,"Not quality that i expected from Persil.The pods don't dissolve properly at low temperatures. I am not overloading machine; I am remembering to put pod at back of machine. I find bits of semi melted pod all over machine or, worse, clothes",True,49,266
529,5,We donÂt buy anything else,True,5,27
530,4,Keeping washing machine going,True,5,33
531,5,Excellent value,True,2,15
532,5,Good,True,1,4
533,5,Quality,True,1,7
534,5,I use 2 at time as I always have large loads. Does job & smells better than some of others I have used recently.,True,27,122
535,3,I always go for Persil as itÂs non bio itÂs cheap but it always leaves lumpy large residue behind,True,20,103
536,5,I didnÂt read about details correctly. ItÂs 6 small bottles totalling 3.6 litres. Expensive for that quantity when 1.9lt bottle is only Â£2.99,True,25,150
537,4,Read few post Amazon were selling these 38 washes sending out larger ones so decided to order. They are small bottles has advertised. Not sure they're worth Â£2 bottle shops are selling larger ones for 50p extra. Lovely spell don't use any other fabric softer you only need little amount.,True,54,298
538,5,Excellent value for money,True,4,25
539,5,"Brilliant price, happy with my purchase. Should last while.",True,10,61
540,5,It is what it is my wife was happy with it,True,12,46
541,5,It's got luvly smell it saves my carrying home from shops much easy to have it delivered only mistake was I ordered wrong size I need 90 wash but not to worry i'l double check next x,True,43,204
542,1,Tiny little bottles that are not worth money,True,9,48
543,5,A treat much appreciated by my husband we are currently in Portugal he missed his English tea. Perfect. Delivery spot on. Thank you.,False,24,136
544,5,I do not tan on sunbeds spray tans donÂt take to my skin - I thought I would try this out within couple of weeks I could see clear difference. Friends family could also see!,True,40,190
545,4,Very effective washing pods.,True,4,28
546,4,Perfect. Persil is best. Fast deluvery.,True,7,43
547,5,CanÂt go wrong Paid Â£15 for 3 packs.,True,8,38
548,1,"Although these were great price, i have come out in severe allergy, no idea why as i have used before with no problems",True,25,122
549,5,Smells divine ! Will definitely recommend !,True,7,43
550,5,So so happy with this so worth moeny,True,9,40
551,3,"We bought this to save lumbering home large bottles from supermarket. We decanted this into an existing container you could tell straight away it was not as concentrated as one we normally buy. Despite filling conditioner compartment in washing machine our towels were not as soft. Unlike others, ones we bought did have manufacturers labels on them.",True,63,374
552,5,We always use comfort,True,4,21
553,1,"How do I know that this is actually comfort pure fabric conditioner? No labels whatsoever! Very unprofessional, won't be buying again as this could be anything!",True,26,160
554,1,Seemed to have some product missing out bottle.,True,9,51
555,3,Does job,False,3,12
556,5,The family loved this! The marshmallow is particularly good in it,False,11,65
557,4,The ice cream was smooth but very indulgent. The marshmallow was mostly in bottom half of pot didn't really add much in terms of flavour or texture. I would buy it again as an occasional treat.,False,39,205
558,5,"The whole family really enjoyed this ice cream. It was really lovely texture with plenty of chocolate fish. It may be little sweet for some, but we really liked it!",False,32,168
559,4,"This ice cream is nice, has different textures within isnt as chocolatey as it looks, it is little expensive for what it is but its nice as treat. My favourite bit was marshmallow bits within ice cream.",False,42,218
560,5,"A lovely ice cream, nice chunks of chocolate lovely flavour. Its difficult not to eat entire tub!",False,20,107
561,2,I usually buy Mr Muscle one. Ill go back to doing so.,False,13,57
562,5,"Great product, I used this for first time after bath shaving my legs. The lotion wasn't greasy left my legs smelling feeling Fab. I can't wait to take this on holiday with me hydrate my skin after day in sun. [This review was collected as part of promotion.]",False,57,288
563,4,"Winter is really taking its toll on my skin this moisturiser has been wonderful. It soaks in fast, isn't greasy at all has really refreshing aloe scent as well. It does everything I need to does it well. It's water based so probably not best for oily skin, but on my normal to dry it's doing great. I'm pretty sensitive too but this hasn't caused any problems. However, it also contains Palm Oil. Now, palm oil is brilliant ingredient does lot of wonderful things. But at moment, it's rarely ethically sourced that's my only issue with this product. Unilever are big big player need to address this issue. [This review was collected as part of promotion.]",False,128,693
564,5,I have tried this product was totally impressed with how soft it left my skin. Its refreshing to touch as well as to smell. I suffer from dry skin this has made such difference. I will be using this product all time from now on. [This review was collected as part of promotion.],False,59,298
565,3,Decidedly smaller than normal Magnums raspberry Newsweek two layers of chocolate is too sweet too much quantity.,False,22,130
566,4,Gentle with lovely lather. Not so keen on this fragrance but would try others in this range.,False,18,94
567,4,"Many thanks to Ocado for this free trial product, which I got my husband to test out. It is big bottle which should last quite long time. Because itÂs gel rather than liquid this means it is easier to deal with. The fragrance is quite subtle but is definitely recognisable as cedarwood which is quite popular in menÂs bathing products.",False,64,345
568,4,I wouldnt normally choose chocolate ice cream my husband isnt fan either however he was quite taken with this I think tub will disappear quickly!,False,29,159
569,5,"I received tub of this to try. We had it for dessert after Sunday lunch one tub was sufficient for all 4 of us. The children both loved it of course (and gave it million stars out of 5) particularly enjoyed counting how many chocolate fish they found. I thought it was really nice chocolate ice cream with plenty of chocolate fish - much more than I expected - but didnt really think there was lot of caramel or marshmallow content, which was shame. I would, however, buy this product again.",False,98,509
570,5,"If you want sweet rich chocolate ice cream, this will hit spot.",False,14,69
571,1,"Bought these thinking they were ordinary simple cleansing wipes as packaging is same. Even as exfoliating wipes, do not find them good. They are quite dry (the actual wipes are dry - i don't mean they leave my skin dry!) Not good product.",False,47,252
572,5,"I have MS my skin can get burnt fron bladder weakness, using oil gel keeps my skin protected better than any other product plus it smells nice.",False,29,151
573,5,"Very good product, excellent for every day use.",False,8,47
574,5,"This shower gel smells very nice is quite thick, not runny like some other gels. I would definitely buy this again.",False,22,119
575,4,"Great product, very concentrated good lingering fragrance. The bonus is bottle is made from 100 percent recycled plastic.",False,20,129
576,5,"All family love it! Great chocolate ice cream kids enjoyed finding fish! Won't last long in this household, wonderful treat.",False,25,142
577,5,Everyone loved this. Will buy again.,False,6,36
578,2,"I've been using this moisturiser daily for 5+ years it's always been great for price. However recent formula change means that it now stings slightly to apply, has caused dermatitis to flare up around my eyes. I've compared ingredients from before think it's possibly due to inclusion of 2-bromo-2-nitropropane-1,3-diol. Dissapoiting as was always super reliable before, even for my picky skin. Hopefully they'll change formula back otherwise I won't be buying it again",False,81,499
579,5,I just try this product so happy with it. It makes my hair so soft,False,16,70
580,5,"Wow i love this so much,the smell is amazing it lingers on your skin for while as ive notice with other cream it dont,i love that it is non greasy when applying it too which is another good thing,and i love it because this is only cream ive found that works helps with my dry skin that i get in patches on my face,just brill. [This review was collected as part of promotion.]",False,78,391
581,5,"I would very much recommend this product, after using it my skin feels so soft smooth. I believe if I continued to use this long term I would see massive benefits. The bottle is huge, so would last you long time. [This review was collected as part of promotion.]",False,52,270
582,5,"This product is not what I would have bought. Although I like Vaseline products, this one has never appealed to me. The smell is really nice product goes onto skin really well. It soaks in really nicely doesn't leave residue like some products do. [This review was collected as part of promotion.]",False,58,317
583,5,"This product smells gorgeous. I have used this in kitchen, will certainly buy in future. A great hand wash, lathers well, non drying to skin.",False,30,161
584,2,My husband used this deoderant found on application was very uncomfortable under arms with stinging sensation for quite some while after use.,False,24,147
585,1,I poured this in kitchen sink drain left it overnight. Drainage no better in morning. Then got Essential Waitrose drain unblocker few days later it did job!,False,32,174
586,4,If you like chocolate icecream then this is good one! Good texture as well,False,15,76
587,4,Lovely creamy with good chocolate flavour. Contains no GMO,False,9,58
588,2,"I have always used Cif thought it great product. However, now micro granules in it are no long plastic you have to be careful where you use it as it does cause fine scratches - be wary of using on stainless steel.",False,45,223
589,1,why change what was great - no option for no starts,False,11,51
590,5,This is best stock ever-unless you make your own! Gravy is richer has wonderful flavour. Wouldn't be without it.,False,22,122
591,1,Shame they contain palm oil (albeit labelled 'fat'). You would have thought that these would have been reformulated by now given all publicity.,False,24,147
592,5,My husbands favorite - but impossible to find at any of my previous sources. I will check out Target. Thank you.,False,21,112
593,5,"I'm really impressed! This was my first time using self-tan so I was nervous how it would turn out but it worked perfectly - gradual tan that you can build up, very light texture so it dried quickly didn't stain or streak. Love it!",False,46,237
594,5,A lovely subtle soft colour to skin. I am pale use medium to dark. Dove scent no fake tan smell so far. I use for 4-5 days in row then once or twice weekly. Just Keep rubbing in gently till absorbed.,False,46,217
595,5,"As regular user of number of simple products, I was very impressed with there refreshing shower gel. I suffer with quite dry skin during winter, when using other brands of shower gel they can sometimes act harshly leave my skin quite dry flaky, especially on my face. However with this simple shower gel this is not case. It does not irritate my skin in face it leaves my complexion looking clearer my skin feeling soft. The size of bottle is adequate for everyday use regular use. And although packaging is quite mild it does job. I would definitely choose this shower gel out of choice. A little bit goes long way, product has pleasent scent. [This review was collected as part of promotion.]",False,141,756
596,5,"I love having shower in morning moreover, using really fresh shower gel. This is first thing I need to have great day. With Simple Refreshing Shower Gel, this is exactly what I was looking for. Something simple non-odorous. The Refreshing Shower Gel is perfect blend of ingredients to clean energise your skin. Perfect for even most sensitive skin [This review was collected as part of promotion.]",False,78,437
597,4,"I got this product few days ago used it already many times. While you might think refreshing shower gel is quite ""liquid"" in its form, you could feel cucumber extrat, which i found great! Often, products say things on their bottle don't truly mean it whereas Simple Product was not one of them. Secondly, smell is amazing my skin has not badly acted upon it. I do think it is good product but it might not please others as well! [This review was collected as part of promotion.]",False,98,510
598,5,I love simple range! It's great for my sensitive skin! Had never tried shower gel but it's now only shower gel I will continue to use. Left me feeling fresh knowing it's best for my skin makes me more likely to recommend. [This review was collected as part of promotion.],False,55,289
599,5,"I always use simple products so when I got notification to request this product I was very pleased. As always, Simple has produced another great product that says what it does on tin. My skin reacts well to Simple products I am very pleased with this shower gel. [This review was collected as part of promotion.]",False,60,326
600,5,Simple refreshing shower gel. Personally. Didn\u2019t. Liked. It. But. My. Daughter. Enjoying. Using. It. She. Love. It. And. Asked. Me. To buy. More when. It\u2019s. finished [This review was collected as part of promotion.],False,35,227
601,4,"This is really good shower gel for sensitive skin, there isn\u2019t an overwhelming fragrance which lot other shower gels have cause irritation without us even realising. The simple shower gel foams well, it\u2019s not drying yet still very refreshing. [This review was collected as part of promotion.]",False,51,312
602,5,"Just like rest of simple range, this product is really kind to skin. I have pretty sensitive skin so this is great for me would defintley recommend to others. Simple design but works well. [This review was collected as part of promotion.]",False,47,256
603,4,"This Simple shower gel is clear gel that lathers up really really well, so you don't have to use much to feel clean. As like other Simple products, it doesn't have perfume, so it's pretty much odourless, with hint of cucumber smell. It feels really natural whilst also making me feel clean, so will definitely be buying again! [This review was collected as part of promotion.]",False,69,382
604,5,I always been big fan of Simple shower gels they just never disappoint. This one smells really lovely And feels nice kind to my skin. Perfect for everyday use would always recommend it to friend. [This review was collected as part of promotion.],False,48,259
605,5,"Love this shower gel mostly for its simplicity fact that it does not contain any nasty chemicals. The scent is simple smells bit like soap, it foams nicely on skin leaves it soft hydrated. [This review was collected as part of promotion.]",False,50,266
606,5,"This shower gel really is simple to use. A small amount created lovely thick lather that left my skin feeling incredibly clean, soft refreshed. There's no perfume - just clean, fresh smell no skin irritation. [This review was collected as part of promotion.]",False,48,272
607,4,"Got for my husband for change. Classic lynx deodorant. DonÂt use too much, smell can be overpowering but clean smell that last for day.",False,27,146
608,5,"My skin was dry, itchy scaly no matter what I did, nothing helped. I switched to Dove Deep Moisture body wash. All commercials are right! It changed my skin after just first use. My skin is so soft all itching has stopped. I feel like different person. Love this product!",False,57,297
609,4,"This body lotion is generously sized lasts for long time, therefore great value for money. It's smooth to apply, leaves no sticky film on skin smells nice. It's low key product that is really great for everyday use. [This review was collected as part of promotion.]",False,52,283
610,4,"IV only used this Vaseline intensive care Aloe soothe body lotion couple of time so far, this had pleasant smell soaked in my skin very quickly, so far very impressed with this product so would recommend to friends family [This review was collected as part of promotion.]",False,52,285
611,5,Works like magic,True,3,16
612,5,"Great value for money!!! Great buy, I didn't think twice.",True,10,57
613,5,Cleans hair well though,True,4,23
614,5,Good value.,True,2,11
615,5,"Big bottle, low cost. Lets not go too deep.",True,9,43
616,3,Thought I was getting bargain but found it cheaper elsewhere,True,11,62
617,5,"This is absolutely indistinguishable from finest dairy vanilla ice creams - it has very sweet milky taste proper ice cream texture, but is fully vegan! Have fun fooling your dairy-eating friends with it. They wonÂt believe itÂs not dairy.",False,42,250
618,5,"Liked this, lathers up nicely has lovely subtle fragrance. Left my hands feeling soft clean, would definitely purchase again, good value product at Â£1.40!",False,27,165
619,4,"Decent size bottle, with firm lid. The smell is subtle, but quite nice gel is firm enough to wash with.",False,23,113
620,5,Lovely fresh!,False,3,17
621,5,Obviously....chocolate. ice cream. what more to like?!,False,7,54
622,5,"We really enjoyed this, creamy ice cream with plenty of chocolate 'fish' pieces",False,13,79
623,4,Really lovely rich creamy ice cream. Went down great with kids. While its good size tub its probably for of treat than all time purchase.,False,29,149
624,3,"Nice flavour, although very very sweet texture seems little artificial",False,12,76
625,5,It's very good looked it good price it big good size,False,12,56
626,5,for snacks,True,2,10
627,5,Great value good service,True,4,24
628,5,Brilliant value for money,True,4,25
629,5,Love it love it,True,4,15
630,5,"Like smell, lathers well little goes long way",True,12,57
631,5,Long lasting scent barely any sweat.,True,7,40
632,5,"large packs, works out cheaper than shops. will order again.",True,11,64
633,5,I have used this deodorant for last 5 years it is by far best one IÂve every used! I could not be without it! I always had problems with sweat growing up this has given me so much confidence!,False,43,208
634,5,As expected,True,2,11
635,5,The original smell of teenagers in 90s,False,8,42
636,4,What treat! Thank you Ocado for sending this for me to review. Very chocolatey ice cream with nice extras like chocolate fish marshmallow. Its very indulgent but lovely for an occasional treat.,False,34,199
637,5,"I was sent this product to review, love new style bottle, stands out bit, shower gel was nice consistency, produced good lather had great fresh scent, lot of men's toiletries have heavy scent but this was subtle, really liked it will buy in future.",False,55,280
638,4,"Feels nice on hands, aroma isnt cloying.",False,9,48
639,5,Convenient,True,1,10
640,5,Always bulk buy tresmemme from amazon,True,6,37
