,review_rating,review_text,verified_purchase,total words,total characters
0,5,"As you get older, you know what you like what is suitable for your body. I like all Dove products. Gives you that fresh all over, wide awake feeling no dandruff or flakey skin. No smelly a/pits!",True,39,202
1,5,"Three gigantic marmite jars that will last probably whole life! What else would you possibly wish for? Order came in time, when mentioned, safely packed. Very happy with it.",True,30,175
2,4,Excellent,True,1,9
3,5,A great flavour top - up for slow cooking.,True,9,42
4,5,Does what is says it does,False,6,25
5,4,Excellent item.Good for men,False,4,27
6,5,Thank you IÂm very happy,True,5,25
7,5,Beautiful,True,1,9
8,5,Always buy. Big bottles,True,4,23
9,5,Always use this product on my heavily mistreated hair it works wonders time after time,True,16,90
10,5,Great value,True,2,11
11,5,"ItÂs not one in picture, but gets 5 stars because itÂs regular one I use itÂs awesome for people with dry skin.",True,26,130
12,5,"Item as described, excellent quality, rapid delivery Great for skin irritations, redness, blemishes",True,13,99
13,5,Good body wash but not very strong smell,True,9,42
14,5,Great,True,1,5
15,5,Worth it!,True,2,9
16,5,I remember trying this at friends house years ago. Now Ive been using it for about 3-months its only one Ill buy.,False,25,123
17,5,Great,True,1,5
18,3,Not best antiperspirant out there unless you like going to work with snow drift under your arm.,True,19,101
19,5,Love this product,True,3,17
20,5,If I die eating one of these I\u2019ll die very contented man. I love \u2018em,False,16,80
21,5,"I love this range of body lotions as they aren\u2019t greasy, are easy to apply soak in quickly leave my skin feeling super soft moisturised. Great value for money scent is fresh light, great go to beauty essential in my bathroom cupboard. [This review was collected as part of promotion.]",False,58,317
22,5,"I suffer with dry sensitive skin vaseline is one of very few products that doesn't make my skin flare up itch like crazy!The first thing I noticed was beautiful fresh smell that escaped as I lifted cap, as I applied drop to my skin I instantly felt soothing relief easily moisturised into my skin absorbing effortlessly not at all greasy unlike alot of other moisturisers I've tried! I use this product every day it has improved my dry skin condition massively couldn't recommend this product enough I absolutely love it! [This review was collected as part of promotion.]",False,108,605
23,5,Absolutely love this stuff ... leaves lovely lingering fragrance that you can smell each time you open wardrobe or clothes drawer ... gets everything clean really well too Reminds me of when I was kid Mum just put me in some freshly laundered clothes ... lovely,True,50,271
24,5,Very happy with it,True,4,18
25,5,I love that I now wash my cashmere sweaters at home. Saves me lot of money compared to taking my clothes to dry-cleaners every week. Very happy with my purchase,True,32,166
26,5,So prior to receiving this I had pretty rough elbows in particular my skin feels dry. As busy mum of two I admit I sometimes neglect myself.. some of you may empathise! But this product trial gave me perfect opportunity to reconnect with myself have bit of \u201Cme time\u201D. So for 3 days after my baths / shower I smothered myself with this. I must admit first time I put this on I wasn\u2019t sure about smell. It\u2019s not offensive it\u2019s like cucumber smell (although it\u2019s aloe) but I tend to smell of perfumes all time.. however by day 3 I actually liked smell. Application: it went on nicely not too thick soaked in pretty quickly it didn\u2019t feel sticky. I always have my morning wash by 07:30 but even in evening before bedtime my skin is feeling noticibly softer my rough elbows gone. Verdict: thumbs up. Yes I will be continuing to use this thank you for fab product trial for introducing me to Vaseline Aloe! [This review was collected as part of promotion.],False,191,1039
27,5,Happy with item,True,3,15
28,5,"I really like this. The texture is almost like gel so it's really light easily absorbed into my skin, leaving it feel soft fresh, without any of weight that some thicker creams have.I would buy it again. [This review was collected as part of promotion.]",False,50,269
29,5,Smells nice,True,2,11
30,5,A great deal on treseme shampoo giving long lasting supply so you donÂt need to keep buying more very good price.,True,23,120
31,5,Great value,True,2,11
32,5,Love this comfort,True,3,17
33,1,Horrible.,False,1,9
34,5,great buy,True,3,11
35,3,"Love container, easy to pour, but am refilling with A. Nother automatic liquid in future as it is very thick gloopy (hard to be economical) it is so scented you smell like it when wearing what you washed (which some may love but I do not!) -after 3 rinses!",True,52,268
36,5,Washes sharks well,True,3,18
37,5,excellent,True,1,9
38,5,Good pleasant smelling deoderant boys will love it at christmas.,True,10,64
39,4,delivered quickly decent shampoo. only 4 star as one bottle was leaking when delivered,True,15,90
40,5,"Have used lot of make-up brands in past bought their more expensive make-up remover products, but none have ever removed mascara, eye-shadow, foundation bases etc as gently as well as Simple Cleansing Lotion. Its consistency is not runny, you have to squeeze bottle appropriately onto cotton wool, which is ideal for controlling how much is dispensed. Also great for tidying up eyeliner or mascara errors when applied sparsely on cotton wool bud. Always keep this now in my bathroom cabinet. Why pay more?",False,90,529
41,5,not sure why big jar costs more than double this size though!,False,13,65
42,5,"Got this on offer for Â£6, clothes come out very soft, smelling great. It should last long time too, its 100% genuine as well",True,27,135
43,5,"For Â£6 this is an amazing buy- lasted me months!, smelt amazing my neighbour even asked me to buy her one!",True,22,111
44,5,"Great buy, smells gorgeous",True,4,26
45,5,Texture liked.used for bath/shower,True,4,34
46,5,shared with family,True,3,18
47,5,We love it even better when itÂs on deal,True,11,47
48,5,Great product!,True,2,14
49,4,"Bought items to give as gifts, it was advertised as Dove Moisturising Deeply Nourishing Body Wash but I received Dove idratante bagnodoccia di belleza, language I cannot read. Even has less distinct fragrance.",True,35,213
50,4,"Good price nice smell, not overpowering. DoesnÂt leave white powdery mess like some anti perspirents do. Happy.",True,18,116
51,5,"Good wipes, good buy",True,4,20
52,5,Nice fragrance it seems to last on clothes.,True,10,51
53,5,"I've been Using tresemme products for years. Previously regular heat protection but after being recommended this one for colour treated hair gave it go Ive not looked back! Leaves my hair with lovely shine, ive got dyed red hair so it can be hard to keep looking healthy. Seems to do Good job with heat protection too. I only dry my hair, no straighteners or tongs but seems to keep damage away",False,78,412
54,5,So much cheaper than in Boots. Great value!!!,True,8,45
55,2,"I like blue version but this is such an overpowering, awful smell it had to be binned.",False,18,90
56,5,"I like these, I use only one in regular wash everything comes clean. I'll use two if I load 9kg wash or if I have lot of white washing just to give an extra boost as machine uses more water on these cycles. It's good value for money buying in pack of three so these are regular purchase for me.",True,67,314
57,5,Excellent value you don't hav to carry it,True,9,45
58,5,Washing,True,1,7
59,5,Lovely fresh smell,True,3,18
60,5,great item,True,2,10
61,5,WhatÂs not to like noodles that taste like spare ribs,True,10,54
62,5,"This is good deodorant if you have easily irritated skin. It's like Dove soap in that it doesn't seem to irritate or dry out skin. I've used Dove soaps for quite long time this is certainly something which they are good for, this seems to be as good as all of them. It's main selling point, beyond being an effective 24 hour deodorant, is that it is not prone to marking your clothes. It certainly seems to work as far as that goes too, though we haven't been able to test on every single colour. Good though. Recommended.",False,101,530
63,5,Great body wash. Cheap fast delivery,True,7,40
64,1,"yet to try taste but why, in this day age, start producing what was perfect in glass bottles suddenly in plastic?",False,23,121
65,1,"Not even worth one star. Bring out lot of white stuff, had high expectations but this product is total failure waste.",True,24,125
66,5,Bought this for my step dad,True,6,27
67,5,Love this on my OH. It smells so good on him but I hated it for years still do on everyone else,True,23,99
68,5,Great gift,True,2,10
69,5,This is classic you know when its Hellmans Mayo. Cap stays so much cleaner than jar. Tastes great with EVERYTHING!,False,23,124
70,5,Cool,True,1,4
71,5,Absolutely great moistures for dry skin. Can complain. ItÂs smells great of skin if you like that coca butter smell.,True,21,121
72,5,Great package buy,True,3,17
73,5,Works well truly invisible,True,5,30
74,3,Nice cost effective,True,4,23
75,5,Great,True,1,5
76,5,Does exactly what it says my kitchen sink is always getting blocked since I have put this down it has not been blocked for last 2 months,True,29,144
77,4,"This is my favourite scent from intense range, smells lovely lasts ages on my clothes. I do use more than recommended amount otherwise scent isnÂt very strong, so it definitely doesnÂt do 64 washes, probably half that.",False,41,236
78,5,I find these to be best for my laundry part of that includes only using one - not over dosing like I do with liquid or powders. smells great washes well.,False,35,167
79,5,And under 150 calories for really big portion,False,9,47
80,4,The cream is very easy to apply feels extremly cooling. It doesnt dry with any kind of sticky feeling to it. There is very little or no scent to it so fact frangrance is fairly neutral is good. The cream spread soaks in very easily [This review was collected as part of promotion.],False,59,303
81,5,"Execellent product, made my skin feel silky smooth extremely hydrated. Used it for couple of weeks my skin felt healthier, more hydrated overall looked better. Would definitely recommend this product to friend. [This review was collected as part of promotion.]",False,46,278
82,4,"This cream is light, odourless leaves skin feeling genuinely smooth, supple refreshed. I use it as part of my nightly routine - applying it when going to bed after washing drying my face. It is light enough not to clog pores or feel sticky on face, in morning my face always feels smooth replenished. I have also tried using this cream during daytime and, while it has all benefits described above, it\u2019s not long-lasting enough in terms of hydration it gives, meaning you often feel need to reapply after few hours. All in all great overnight moisturiser if you have sensitive skin - it\u2019s unscented it\u2019s really gentle on sore patches. [This review was collected as part of promotion.]",False,136,761
83,5,Fresh clean. Reliable delivery,True,5,34
84,5,"Great combination, started using when my now 3yo was born am still using it",True,15,79
85,5,Nice fresh smelling products,True,5,32
86,5,"We all crave things that transport us back to more innocent times. For me Bovril is one of those things, from gooey unctuousness of tar black bovril overflowing from spoon to ""ding ding ding"" as I stir it in hot water to make it dissolve earthy, beefy smell with hints of celery goodness knows what else. Sometimes you can get alcohol fatigue so Bovril is great alternative to nightcap or even mug of tea. I even go so far as to dissolve pat of butter in it too for extra richness within an hour I'm pretty much knocked out sleep soundly until morning, warm comforted. This pack will last me long time I am sure, certainly 2 winters.",True,132,681
87,5,"Lovely, but can be bought cheaper in home bargains !",True,10,52
88,1,Item was damaged unable to pour without spillage.. have transferred to another bottle as unable to wait for replacement.,True,20,124
89,5,Good price.,True,2,11
90,5,It came very fast.,True,4,18
91,5,Hi Simple!This is my absolute must-have facial moisturiser now I cannot find it in UK stores anywhere. Have you discontinued this product?! Please don't!,False,25,157
92,1,Please go back to old capsules - these new ones make our household suffer terrible allergic reaction - constant hay fever!,False,23,128
93,4,Never usually use laundry softener but was very pleasantly surprised by results with this product. Clothes smelt great smell lasted despite childrens best efforts! And clothes came out much softer. Think I am converted!,False,39,239
94,5,I am marmite lover. I have switched back to glass jar because 1. marmite isn't right consistency to be squeezed 2. glass jar can be recycled.,False,31,159
95,5,Great,True,1,5
96,5,Thank you,True,2,9
97,5,I got this itÂs be great buy. DonÂt have to put much into wash clean clothes at end of was fragrance last long time too,True,29,135
98,5,"I had been lured by all enticing fragrances on other conditioners but noticed that my eyes would smart my kids would ask why I seemed to be squinting my eyes. I'm now back to using Comfort Pure as I used it before with no reactions. Smells good, softens clothes, can't complain!",False,53,286
99,5,"Gives good result - fragrance is very strong though it lasts long time. I really like it but if you donÂt, you wonÂt really be able to still use product as there is no avoiding it.",False,41,198
100,5,Good,True,1,4
101,5,Good size spray,True,3,15
102,5,The price of this bulk pack is less than buying items individually from somewhere else. I won't use any other shampoo because they tend to dry my hair I don't like using lot of chemicals. This product is perfect as it contains nothing keeps me dandruff free. Even anti-dandruff shampoo doesn't always work I've found in past.,True,62,343
103,5,Like to make my own soups & casseroles. This product does very well for that.,True,15,77
104,5,The best ice cream ever,False,5,23
105,5,I live in an extremely hard water area half year. As soon as I'm here my hair becomes dry scalp sensitive...this is great shampoo! Both my husband I are completely satisfied.,False,37,194
106,5,Easy to use. I will recommend it if you want to get all glam up to go out somewhere this is product to use,True,25,110
107,1,Disappointed shows big conditioner but small arrived,True,7,52
108,5,We all know how this works,True,6,26
109,3,DoesnÂt clean my clothes too well if there is too many clothes they wonÂt smell good other wise price is good,True,22,115
110,5,I would recommend - good value,True,6,30
111,5,I will be buying again thank,True,6,28
112,5,What more is there to say,True,6,25
113,5,Always been fan of dove products. Antiperspirant effect lasts longer than any other product I've ever used before. Really gentle on skin keeps me fresh all day long.,True,30,171
114,5,As expected - repeat purchase,True,5,29
115,5,Excellent value for money,True,4,25
116,5,Excellent cleaning. Good value.,True,4,31
117,5,Very happy with it,True,4,18
118,5,Excellent value,True,2,15
119,5,Great Value shampoo,False,3,19
120,5,Exactly wat it says on box but for an amazon deal so less money spent!,True,16,74
121,1,IÂve both exact similar 5 litre one from Costco before which thick smelt lovely similar to regular sized ones from supermarkets so I donÂt think large quantity is issue here. This one from Amazon is very runny as if itÂs been diluted doesnÂt smell or soften clothes same. This may be fake IÂm thinking. Really curious if bad batch or if amazon is not sourcing genuine product. Very baffled.,True,74,413
122,5,Amazing offer price. Couldn't resist.,True,5,37
123,1,I have hands that are really dry bleed due to eczema this is only handwash that dosent dry my hands out more make them bleed.,False,29,141
124,5,"No issues, does what it says",True,6,28
125,5,Need I say more. Use them all time for soups risottos.,True,13,62
126,5,I simply love this deodrant. The scent is great - fresh sporty. I have been using it for 3 weeks now never had problems. What is more it never leaves white marks on clothes.,False,37,185
127,5,Thicken gravy really well add wonderful flavour,False,9,53
128,5,Amazing great price too,True,5,27
129,4,"Smells great, easy one handed application",True,6,41
130,5,Very good value I would recommend.,True,6,34
131,5,Body deodorant we love smell great value for money.,False,11,59
132,5,The only floor cleaner I use. It smells good my home feels so refreshed using it,True,17,84
133,5,Btilliant buy,True,2,13
134,5,Value for money,True,3,15
135,5,"All fabric conditioners work more or less same, but this one smells divine it lasts too.",True,18,96
136,2,Couldn't find any in shops so bought on-line. Thought it was fake branding because it smelled similar but not quite Africa. Poorer product since new labelling!,False,27,163
137,2,"Been using this for year, very happy. Last 2 cans nozzles have blocked within week. Cant clear them with hot water - bit disappointed",False,27,141
138,1,"I have been buying this for years. The contents are good. However, bottle itself is awful. Three times it has cut right under my fingernails when opening. Also, you can't turn it upside down as it approaches empty due again to ridiculous design of this bottle.",False,48,268
139,5,"Pleasant to use with very little scent, which was what I wanted. These shower gels are brilliant! No nasty chemical smells super clean design, great for whole family, young old. Simple products are skin friendly, meaning no perfumes, no colours. I can honestly say these are only products that don't leave me with skin irritation. I have very sensitive, problematic skin am prone to dermatitis. This stuff could be used as face wash, it's so gentle. [This review was collected as part of promotion.]",False,91,523
140,5,"These wipes are great for getting most stubborn make up off, I love fact wipes are infused with minerals plant extracts, that when using then,ther is no irritation or stinging, my face feels smooth an refreshed [This review was collected as part of promotion.]",False,50,282
141,5,Great quality wipes that are strong to use don't tear apart like other wipes. A must buy over other brand names I'll be purchasing more in near future. Very satisfied with simples product line. [This review was collected as part of promotion.],False,46,257
142,5,I love these face wipes as they do at great job at removing make up left my skin feeling squeaky clean! Added bonus was absence of strong smell or feeling that some product was left over on my skin. Love them. [This review was collected as part of promotion.],False,54,273
143,4,"I have sensitive skin, but these worked really well. Took my make up off easily didn\u2019t irritate my skin. Felt really refreshing. I would definitely purchase these again for future use would recommend this product. [This review was collected as part of promotion.]",False,46,278
144,5,Been using for few months Really pleased how they work Get make up off very easily smell nice Not to wet so leave skin moisturised silky clean No irritation Defiently my new favourite make up remover [This review was collected as part of promotion.],False,48,261
145,4,"Tried tested this skin quenching night cream,it's of very light soft texture when applied at night soaks into your skin making it fell so soft. Would recommend this product to my friends family as it works wonders . [This review was collected as part of promotion.]",False,51,281
146,4,Happy with this product. Very light on skin not sensitive. I would recommend it. Can apply as much as you wish during day it doesn\u2019t feel bad. Comes in an easy to use plastic tub with an easy screw top [This review was collected as part of promotion.],False,53,274
147,4,"This is great water based moisturiser, that is light on your skin gives you dewy complexion. Since I have been using this product twice day, I have noticed significant improvement in my skins elasticity skin tone. [This review was collected as part of promotion.]",False,51,281
148,5,"This is another great product from Simple, so don't ever stop making it!! Please!!",False,14,82
149,5,good flavor,True,2,11
150,5,great,True,1,5
151,5,No question as it says on bottle,True,8,36
152,4,Very good value. My favourite conditioner.,True,6,42
153,5,lovely smell,True,2,12
154,3,"Love product, however itÂs hard to spray. Would recommend though.",True,11,70
155,5,Got this to try wasnt disappointed. Its little less thick than some other conditioners on market but this makes it go further also I notice tray doesnt get as mucky afterwards. The clothes were soft had lovely subtle scent - still using large bottle so its going long way!,False,58,302
156,5,A little goes long way,False,6,24
157,2,"Not convinced that smell matches original, seems less thick than previous. Why does description refer to batteries? Other reviews show as Verified Purchase - but none have names?",True,28,178
158,5,This is such great soap. Me my wife loves it. It actually moisturizes our skin everytime we used it.,True,21,106
159,5,"Love these soaps, cleans well keeps your hand moist. Good for people with eczema",True,15,84
160,5,Definitely worth money! I do laundry very often these lasted me for over month! Definitely will buy again.,True,21,116
161,5,"Arrived super fast. Two good sized bottles. I dont know why some people are moaning in reviews about size of fabric softener- its ultra concentrated so you dont need to use full cap, it will last you long enough. Fabric softener also smells great.",True,49,265
162,5,Great product very happy with it,True,6,32
163,5,Great price at Â£6 when i purchased. If it was still this price i would subscribe buy more.,True,19,95
164,5,"Lovely smell, can pour into smaller bottles to make using more manageable. Can't beat it for Â£5!",True,17,97
165,5,These pods work as well as any other I've used great value (18 for three bags when I bought),True,20,96
166,5,I love Comfort Pure. Both our children have sensitive skin it doesn't irritate like other softeners have done in past. The scent is also very pleasant not too overpowering,False,32,183
167,5,Thanks,True,1,6
168,5,Bit watery,True,2,10
169,5,Good,True,1,4
170,2,Blue bottle is alot better. This smells less than blue bottle when clothes are hanged outside on washing line you can't small anything,False,24,138
171,5,"Great value for money, smells nice seems to stop my hair being static days I use it",True,18,87
172,3,Good product,True,2,12
173,2,Product arrived broken had spilt all over inside of envelope.,True,13,73
174,2,did not squirt very well,False,5,24
175,5,Very good value for amount of capsuls you get in packet very good price,True,18,85
176,5,"Bit too runny,not as thick liquid as most but ok.",True,10,49
177,5,Works great,True,2,11
178,1,"I have used Simple Rich moisturiser for years, I now need to find an alternative as new formula burns my skin. It's real shame that loyal customers are having to switch, with no information or explanation provided by manufacturer.",False,42,240
179,5,excellent value for money,True,4,25
180,5,These are great. I will buy more!,True,7,33
181,3,But that's personal taste. Sold mine on.,True,7,40
182,5,All three of flavours are so good,False,8,37
183,5,I have tried many English mustards in my time but always come back to Colmans. If I am out for Sunday roast I take tube with me as invariably I will be served an inferior one.,False,38,179
184,5,"As title suggests, I really wont buy any other tea bags. PG Tips have good, strong flavour. I like strong tea can get really good cup with these tea bags. Not overly packaged, which I like. I have never had any problems with damaged tea bags as others have mentioned. Will continue to buy these as staple.",False,63,321
185,5,This is bleach. Bleachy bleach bleach!,False,6,38
186,4,"I have been buying this shampoo for my husband (who shaves his head every other week) for years, as he doesnt require an expensive shampoo. The fragrance is lovely he has no complaints about product. Lathers up well cleans his head/tiny bit of hair perfectly. Nice packaging. You really cant go wrong for Â£1",False,57,320
187,5,"This Dove deodorant stick is best deodorant I have ever used. It goes on lovely, smells amazing leaves me feeling dry confident that i smell fresh all day long. I love this product, 5 stars highly recommended.",False,41,225
188,5,Great quality,True,2,13
189,5,"Buy this on my amazon prime orders, no problem at all",True,11,53
190,5,"Great product, lovely scent. Lasts me ages.",True,7,43
191,5,A+,True,1,2
192,5,Washes clothes nice,True,3,19
193,5,Great taste adds depth of flavour to any meal. More importantly to my family is that they're gluten free,True,20,108
194,1,Years ago I used to love pot noodles as student but these were yuck! I had to add additional sauce even then pasta tasted like carboard. I was in situation recently where I only has access to kettle chose these over mugshots.....big mistake!!,True,49,260
195,1,"While I like product, bottle is unsuitable. The plastic is very thin, which is good thing, this means it almost impossible to pick up bottle fill very small cap without spilling significant amount, especially when bottle is still relatively full. Do buy this, but only if you are happy to decant content into sturdier bottle.",False,66,363
196,5,I love lynx products so was happy to buy this to write review. I am female but I like scent of mens products I think scent stays longer on skin. Nice consistency too so you don't lose it off your hands down plughole!,False,50,242
197,5,perfect,True,1,7
198,5,Great product! Great price,True,4,26
